{
  "loai": "ARM_RESULT",
  "arm": "Z0",
  "huong": "LONG",
  "dataset": "WFO",
  "pham_vi_phan_quyet": "mo_ta",
  "nguon_phan_quyet": "toan_cua_so",
  "n_toan_cua_so": 46,
  "n_chi_test": 13,
  "cua_so_toan_bo": {
    "start": "2025-06-12",
    "end": "2026-01-28"
  },
  "cua_so_chi_test": [
    {
      "start": "2025-09-04",
      "end": "2025-10-23"
    },
    {
      "start": "2025-10-23",
      "end": "2025-12-11"
    },
    {
      "start": "2025-12-11",
      "end": "2026-01-29"
    }
  ],
  "lenh_theo_thang": {
    "2025-06": 6,
    "2025-07": 15,
    "2025-08": 12,
    "2025-09": 8,
    "2025-10": 2,
    "2025-12": 2,
    "2026-01": 1
  },
  "so_ma_da_chay": 107,
  "delta_r_pham_vi": {
    "so_ma": 2,
    "so_fill": 91,
    "dataset": "CALIB",
    "chien_luoc": "ZoneAbsorptionMinimal"
  },
  "chi_so": {
    "mean_r": {
      "status": "ok",
      "value": -0.11243106022885781,
      "note": null
    },
    "ty_le_rui_ro_da_trien_khai": {
      "status": "ok",
      "value": 0.4439011771170031,
      "note": null
    },
    "mean_r_ngan_sach": {
      "status": "ok",
      "value": -0.05529545988506077,
      "note": null
    },
    "std_r": {
      "status": "ok",
      "value": 0.9401118892909043,
      "note": null
    },
    "thue_nhieu": {
      "status": "ok",
      "value": 0.42660954943960705,
      "note": null
    },
    "dsr_adj": {
      "status": "ok",
      "value": -0.5390406096684649,
      "note": null
    },
    "tp_fallback_ratio": {
      "status": "ok",
      "value": 0.09523809523809523,
      "note": null
    },
    "time_stop_ratio": {
      "status": "ok",
      "value": 0.0,
      "note": null
    },
    "max_single_trade_loss_over_risk_budget": {
      "status": "ok",
      "value": 0.49535316591557854,
      "note": null
    },
    "trades_per_year": {
      "status": "ok",
      "value": 72.73376623376623,
      "note": null
    },
    "skewness_r_trien_khai": {
      "status": "ok",
      "value": 0.714872214144562,
      "note": null
    },
    "ti_trong_tranche_dat": {
      "status": "unreadable",
      "value": null,
      "note": "0 lệnh khớp đủ ba tranche"
    },
    "stake_theo_r_eff_rho": {
      "status": "ok",
      "value": 0.9082274577525595,
      "note": null
    },
    "bat_bien_1_7_ty_so_trung_vi": {
      "status": "unreadable",
      "value": null,
      "note": "0 lệnh khớp đủ ba tranche — §1.7 không có gì để đo (DR-D4-15 §2.2)"
    },
    "liq_buffer_ratio_mean": {
      "status": "ok",
      "value": 20.12380315169036,
      "note": null
    }
  },
  "ket_cuc": {
    "status": "ok",
    "value": "INCONCLUSIVE",
    "note": null
  },
  "trial_id": "D-0020",
  "provenance": {
    "params_source": "yaml",
    "params_effective": {
      "tier_c.arm_ablation.arm": "Z0"
    },
    "git_sha": "29f9f5252ced4a23a15615bcf5560afd22993a8b",
    "reproducible_from_sha": false,
    "data_hashes": {
      "1000000MOG_USDT_USDT-1d-futures.feather": "4d377bd0f97d4645d14fbd93d9693e5b45bd1658c9e98c4c673dcf275426cad7",
      "1000000MOG_USDT_USDT-1h-funding_rate.feather": "0917d05694b62c942d47ac9ed03be991bb7c73f1df6810a86b870dd75fd031e4",
      "1000000MOG_USDT_USDT-1h-futures.feather": "b48813ed7136c63f89d2509acb59a68214cbd791a8a9c184a8d61215fdd19e5f",
      "1000000MOG_USDT_USDT-1h-mark.feather": "59ef622fdc1763223d1f3f1853205dfcd06342865cc999e2be9d814f8e685997",
      "1000000MOG_USDT_USDT-4h-futures.feather": "dbcc5fb916c788f03c965f84fd17e62f81d5d20cd4677eccf116af3f56f80729",
      "1000000MOG_USDT_USDT-5m-futures.feather": "a01cb122e59caba30bafd3792f5eff238fb3e01378a07a9b76db0f7a5227468b",
      "1000BONK_USDT_USDT-1d-futures.feather": "79439622e94d16c5e632b200be7af67d7098eaee5dc82debd95dc4661adba7fd",
      "1000BONK_USDT_USDT-1h-funding_rate.feather": "258a48d469c73120746c3964b46848a1bf47e66c8f66b27e4f8b37fb1d4f9505",
      "1000BONK_USDT_USDT-1h-futures.feather": "7e3bb040162127254854fd28300fa2ffe00af0b660ff50dcd91680daf71306ef",
      "1000BONK_USDT_USDT-1h-mark.feather": "0fbeb7df016fe8dde01dc2a42bdbb1429dff1b48d5aacb521fe43247d01db075",
      "1000BONK_USDT_USDT-4h-futures.feather": "d3f7652c17720ac72dc12d52bcf23010a6c32ac490ba4950d5a7dc46d810f61d",
      "1000BONK_USDT_USDT-5m-futures.feather": "54cdd76a07fb4c5bdf40dc6872303f72f0202844aad348e1b50764feb99a1d37",
      "1000FLOKI_USDT_USDT-1d-futures.feather": "bb5705f3cb48d43424b0f2d22905822aafb2f81039167f0a2045de5e2be91875",
      "1000FLOKI_USDT_USDT-1h-funding_rate.feather": "648812b3a11d96978c7611203b91dac18f55b93d3f7c51159e1b5c8edc54ff61",
      "1000FLOKI_USDT_USDT-1h-futures.feather": "180250c1f3fa401fee0236f2452b8900e8a97c3790c33146b002e371afbc9e10",
      "1000FLOKI_USDT_USDT-1h-mark.feather": "5114b4ba54544abcf8710dcda6d3272808c33e8bb8d54c3204d944ca783e8f1b",
      "1000FLOKI_USDT_USDT-4h-futures.feather": "64f381814676e47bc337d2085be427952b1a81c9d818ab242d0c9829a8e9480b",
      "1000FLOKI_USDT_USDT-5m-futures.feather": "87af78a109e7e11034f3adea90a37fb8187dd5b8a3d47e5fe15885cbbeb1ad8b",
      "1000PEPE_USDT_USDT-1d-futures.feather": "d21c1c70339b170e79e5e1499127f2ca607b1b48d1f09c84f6fc521d6784e6fa",
      "1000PEPE_USDT_USDT-1h-funding_rate.feather": "f1a767c0722266fc3d5663714061e6901c2fc7968db338054c0efb37c7ecdea9",
      "1000PEPE_USDT_USDT-1h-futures.feather": "9554313a265d3c8d51aaa9ed0fd46dde31d3cdbc971f32399a81f1eafbef39b6",
      "1000PEPE_USDT_USDT-1h-mark.feather": "d5a7fe819abc20d5f7e9ee7b99de0d5269be60e1b6c2815abdc0ebe1a6c09a3d",
      "1000PEPE_USDT_USDT-4h-futures.feather": "8050d20286b448da0bb655f5de11afb1a48f030091b7c0091be0bd94601a1e33",
      "1000PEPE_USDT_USDT-5m-futures.feather": "bb4c7b84ff67bfdc249427c21ed71ab247fa0be07d3dbb1b4f309f9850b9d917",
      "1000SATS_USDT_USDT-1d-futures.feather": "9ef5c470d9ec14210bc8016104f4b74eae03ae972e203b941c530e37dd696e75",
      "1000SATS_USDT_USDT-1h-funding_rate.feather": "1f2343ae361a0b0132f9af5176671a81cca9678051121cea2dcd74e0f7121268",
      "1000SATS_USDT_USDT-1h-futures.feather": "8404f976e5f12e1cd6baae89dea5efc95374332708dab9d71f1bc5c809c1dae8",
      "1000SATS_USDT_USDT-1h-mark.feather": "233f6d196b231146c035e2e01fac9c0159b4b1e1dfeb698b454a81113d3a2b63",
      "1000SATS_USDT_USDT-4h-futures.feather": "c29c5de0a3f1a458135beaf152e729b798345dff55538958dfceb737ed8d43ff",
      "1000SATS_USDT_USDT-5m-futures.feather": "be16666247e32f87b0cb948972966c0228b688ca11f1e67516a05ca0a61c8a50",
      "1000SHIB_USDT_USDT-1d-futures.feather": "f8680bd48e518403890d5485e7f7b75ec20af066b4d4a2eb029f715143852f5a",
      "1000SHIB_USDT_USDT-1h-funding_rate.feather": "2ec5d5f19d50d608513cf93ece5cc364e8aa8ec6698d5f684fae6c1f991449f5",
      "1000SHIB_USDT_USDT-1h-futures.feather": "bd89b896c081caf93cb831a0eafc76b1d2076a168063e3d9be76ab1fcbef71bd",
      "1000SHIB_USDT_USDT-1h-mark.feather": "ba7b819df6a7a28f56e2611abafb606bdaa326a5ae8f7ccf938405983941bc4e",
      "1000SHIB_USDT_USDT-4h-futures.feather": "c51d9cf9513c4108930e565c59f68e9f8498017438983346a2171605cbeafb04",
      "1000SHIB_USDT_USDT-5m-futures.feather": "95b4e45b490bbaab5481ca98839776a2e7a64a9cbc160754719719aca9aaf67c",
      "AAVE_USDT_USDT-1d-futures.feather": "e7c7a39d575ab25ebbd03011249779a7a073c5eab40dfcd5617569c9703886e4",
      "AAVE_USDT_USDT-1h-funding_rate.feather": "2f5c817d17d0db75b605bc509b5eb02d20552631e6c5779a984c2ce4709d1e61",
      "AAVE_USDT_USDT-1h-futures.feather": "4feda4180593a03faffd8bc0251ebb3c82845a543cda71dc168e61ad695ddd4f",
      "AAVE_USDT_USDT-1h-mark.feather": "61d066aa0d01d9c54107565d241ba5f018d5cabbc625a385205b9ac277ebb583",
      "AAVE_USDT_USDT-4h-futures.feather": "294dbe5995e66bbcf3ef44d7c307ec681ffe03a27718ac1d58a047ac37207f94",
      "AAVE_USDT_USDT-5m-futures.feather": "219b69225cb48d01064302036ac3831e9080692c7489ce7a2552ebfb543936bf",
      "ACT_USDT_USDT-1d-futures.feather": "39bef91809590600c5ce2d2cf536391a7a79ad6125b8dbc13902fcf8d5df5c5c",
      "ACT_USDT_USDT-1h-funding_rate.feather": "b6e1e452dd878627083531420a8706c6a2277ec3fc5b676b072a11ee2ff4f8c0",
      "ACT_USDT_USDT-1h-futures.feather": "539a9aa751c44367e84726fb496a00fbf43fcf4dd1eaf676617cd16a44ddf02b",
      "ACT_USDT_USDT-1h-mark.feather": "5b24ec346539a796ee664021d03cd8a64f203289fada6125504762b0d855d278",
      "ACT_USDT_USDT-4h-futures.feather": "4a7734ce1243de448e83fbf63b8fa2aba74675fc2f7820a139f17e7b14d21227",
      "ACT_USDT_USDT-5m-futures.feather": "c9536c791dd0efd60f761fc46e923bed308c7afc90a58fae667aaacdbf9cc4f9",
      "ADA_USDT_USDT-1d-futures.feather": "05a56e23744f5e44cfc10611722e6cceed1cef7f69cae1a391c4cc5bdf8b2bc9",
      "ADA_USDT_USDT-1h-funding_rate.feather": "0c9ffe3be345cb6d91885196eaa63c9637fc71563e0fd03309fe405d05d2c037",
      "ADA_USDT_USDT-1h-futures.feather": "2ea6a960b3d51e47dca88c0274e45f4fd25261bb30ebb342a7fbcce41a7445f3",
      "ADA_USDT_USDT-1h-mark.feather": "0807cdeea95eaf9970e0b2c8e863a1268da2bf298be5995c2efe496c0f288f46",
      "ADA_USDT_USDT-4h-futures.feather": "efbdc98fcc5983bdbd93bde1c0f4586cc4a83b8fa357b995f9f107228cfa3142",
      "ADA_USDT_USDT-5m-futures.feather": "f683e3430af8335e4e9870f4758dc793c4607131ec5e1b3bb6dd1192fb390f45",
      "AERGO_USDT_USDT-1d-futures.feather": "dac24d75353abb43e98f9117d39371eb394ac2551bb0b38a44820798a5f6bee3",
      "AERGO_USDT_USDT-1h-funding_rate.feather": "37d6da6db93376c749e80795e61f1b988f674f3bcf155aaaa3d549bba7d09694",
      "AERGO_USDT_USDT-1h-futures.feather": "a38d2b6129bfc330f29d5b46c1cefd5252d61b9e7304733c0324a777de2466e7",
      "AERGO_USDT_USDT-1h-mark.feather": "25f77102eaf02aae37be52632c30f80a64917b6501cfbdf227d5ea7fe4eee491",
      "AERGO_USDT_USDT-4h-futures.feather": "03cb3435b634d1d7f80fbade9af4e17c404f2237d73b536ab8d39c09e383f059",
      "AERGO_USDT_USDT-5m-futures.feather": "9d23eedc63e987a32023b4b1565d9cf487dfb6c0c3ef1b1311bfaf3fe7b2934d",
      "AERO_USDT_USDT-1d-futures.feather": "12f87e9adc89d011049085814b29ce78208cf9c64835047e0f52b5dd62525f1a",
      "AERO_USDT_USDT-1h-funding_rate.feather": "4fa983a200080f63d171baa06feb71b720c4322b88d52931c458b3d3f42555a8",